<?xml version="1.0"?>
<!--

Copyright (c) 2000-2005, Identyx Corporation.

This program is free software; you can redistribute it and/or modify
it under the terms of the GNU General Public License as published by
the Free Software Foundation; either version 2 of the License, or
(at your option) any later version.

This program is distributed in the hope that it will be useful,
but WITHOUT ANY WARRANTY; without even the implied warranty of
MERCHANTABILITY or FITNESS FOR A PARTICULAR PURPOSE. See the
GNU General Public License for more details.

You should have received a copy of the GNU General Public License
along with this program; if not, write to the Free Software
Foundation, Inc., 59 Temple Place, Suite 330, Boston, MA 02111-1307 USA

<!DOCTYPE digester-rules PUBLIC
  "-//Jakarta Apache //DTD digester-rules XML V1.0//EN"
  "digester-rules.dtd">
-->
<digester-rules>

    <pattern value="mapping">

        <set-properties-rule />

        <pattern value="include">
            <object-create-rule classname="org.safehaus.penrose.mapping.MappingRule" />
            <set-properties-rule />
            <set-next-rule methodname="addContent" />
        </pattern>

        <pattern value="entry">

            <object-create-rule classname="org.safehaus.penrose.mapping.EntryDefinition" />
            <set-properties-rule />

            <call-method-rule pattern="script" methodname="setScript" paramcount="0" />

            <call-method-rule pattern="oc" methodname="addObjectClass" paramcount="0" />

            <pattern value="at">

                <object-create-rule classname="org.safehaus.penrose.mapping.AttributeDefinition" />
                <set-properties-rule />

                <call-method-rule pattern="script" methodname="setScript" paramcount="0" />

                <pattern value="expression">
                    <object-create-rule classname="org.safehaus.penrose.mapping.Expression" />
                    <set-properties-rule />

                    <call-method-rule methodname="setScript" paramcount="0" />

                    <set-next-rule methodname="setExpression" />
                </pattern>

                <set-next-rule methodname="addAttributeDefinition" />

            </pattern>

            <pattern value="source">

                <object-create-rule classname="org.safehaus.penrose.mapping.Source" />
                <set-properties-rule />
                <call-method-rule pattern="source-name" methodname="setSourceName" paramcount="0" />
                <call-method-rule pattern="connection-name" methodname="setConnectionName" paramcount="0" />

                <pattern value="field">
                    <object-create-rule classname="org.safehaus.penrose.mapping.Field" />
                    <set-properties-rule />

                    <call-method-rule pattern="script" methodname="setScript" paramcount="0" />

                    <pattern value="expression">
                        <object-create-rule classname="org.safehaus.penrose.mapping.Expression" />
                        <set-properties-rule />

                        <call-method-rule methodname="setScript" paramcount="0" />

                        <set-next-rule methodname="setExpression" />
                    </pattern>

                    <set-next-rule methodname="addField" />
                </pattern>

                <set-next-rule methodname="addSource" />
            </pattern>

            <pattern value="relationship">

                <object-create-rule classname="org.safehaus.penrose.mapping.Relationship" />
                <call-method-rule pattern="expression" methodname="setExpression" paramcount="0" />
                <set-next-rule methodname="addRelationship" />

            </pattern>

            <pattern value="aci">

                <object-create-rule classname="org.safehaus.penrose.acl.ACI" />
                <set-properties-rule />
                <call-method-rule pattern="dn" methodname="setDn" paramcount="0" />
                <call-method-rule pattern="target" methodname="setTarget" paramcount="0" />
                <call-method-rule pattern="attributes" methodname="setAttributes" paramcount="0" />
                <call-method-rule pattern="scope" methodname="setScope" paramcount="0" />
                <call-method-rule pattern="action" methodname="setAction" paramcount="0" />
                <call-method-rule pattern="permission" methodname="setPermission" paramcount="0" />
                <set-next-rule methodname="addACI" />

            </pattern>

            <pattern value="parameter">
                <call-method-rule methodname="setParameter" paramcount="2" />
                <call-param-rule pattern="param-name" paramnumber="0"/>
                <call-param-rule pattern="param-value" paramnumber="1"/>
            </pattern>

            <pattern value="include">
                <object-create-rule classname="org.safehaus.penrose.mapping.MappingRule" />
                <set-properties-rule />
                <set-next-rule methodname="addChildDefinition" />
            </pattern>

            <set-next-rule methodname="addContent" />

        </pattern>
        
    </pattern>

</digester-rules>
