<?xml version="1.0"?>
<!--

 Copyright (c) 1998-2005, Verge Lab., LLC.
 All rights reserved.

<!DOCTYPE digester-rules PUBLIC
  "-//Jakarta Apache //DTD digester-rules XML V1.0//EN"
  "digester-rules.dtd">
-->
<digester-rules>

	<pattern value="sources">

        <pattern value="connection">

            <object-create-rule classname="org.safehaus.penrose.mapping.ConnectionConfig" />
            <set-properties-rule>
                <alias attr-name="name" prop-name="connectionName" />
            </set-properties-rule>

            <call-method-rule pattern="adapter-name" methodname="setAdapterName" paramcount="0" />
            <call-method-rule pattern="description" methodname="setDescription" paramcount="0" />

            <pattern value="parameter">
                <call-method-rule methodname="setParameter" paramcount="2" />
                <call-param-rule pattern="param-name" paramnumber="0"/>
                <call-param-rule pattern="param-value" paramnumber="1"/>
            </pattern>

            <pattern value="source">

                <object-create-rule classname="org.safehaus.penrose.mapping.SourceDefinition" />
                <set-properties-rule />

                <call-method-rule pattern="description" methodname="setDescription" paramcount="0" />

                <pattern value="field">

                    <object-create-rule classname="org.safehaus.penrose.mapping.FieldDefinition" />
                    <set-properties-rule />

                    <call-method-rule pattern="original-name" methodname="setOriginalName" paramcount="0" />

                    <set-next-rule methodname="addFieldDefinition" />

                </pattern>

                <pattern value="parameter">
                    <call-method-rule methodname="setParameter" paramcount="2" />
                    <call-param-rule pattern="param-name" paramnumber="0"/>
                    <call-param-rule pattern="param-value" paramnumber="1"/>
                </pattern>

                <set-next-rule methodname="addSourceDefinition" />

            </pattern>

            <set-next-rule methodname="addConnectionConfig" />

        </pattern>

	</pattern>

</digester-rules>
